{
  "schema_version": 1,
  "catalogue_version": 2,
  "release": {
    "id": "minor-v0.2",
    "version": "v0.2",
    "kind": "minor"
  },
  "measurement_point": {
    "ref": "v0.2.1",
    "commit": "9833e00a2a69e6b523f5b26b510ddd1ac251c9fb",
    "basis": "published-tag"
  },
  "previous": {
    "release": "v0.1",
    "commit": "5b16ab619dad08d05d3954b734739a506ac53988",
    "report": "docs/08_health/release-health-v0.1.json",
    "basis": "report"
  },
  "toolchain": {
    "node": "v22.21.0",
    "npm": "11.6.2",
    "lockfile_sha256": "810148777ea6883b72467bad62c762609dc81f30b859b04ae0e0c124f12022d9"
  },
  "metrics": [
    {
      "id": "G01",
      "status": "measured",
      "value": 100,
      "raw": {
        "conforming": 1453,
        "total": 1453
      },
      "items": 1453,
      "small_sample": false,
      "failing": []
    },
    {
      "id": "G02",
      "status": "measured",
      "value": 41.36,
      "raw": {
        "with_body": 601,
        "total": 1453
      },
      "items": 1453,
      "small_sample": false
    },
    {
      "id": "G03",
      "status": "measured",
      "value": {
        "median": 25,
        "p90": 224,
        "share_over_500": 2.34
      },
      "raw": {
        "commits": 1453,
        "over_500": 34,
        "lines_total": 120824
      },
      "items": 1453,
      "small_sample": false
    },
    {
      "id": "G04",
      "status": "measured",
      "value": {
        "mean": 99.71,
        "share_over_72": 77.63
      },
      "raw": {
        "over_72": 1128,
        "total": 1453,
        "characters": 144881
      },
      "items": 1453,
      "small_sample": false,
      "failing": [
        "5d4952abe00cc6ec2040c72b54bfe60b620b33f6",
        "cdbfae0edc01334094e737c6bfe609daf5a9cefe",
        "b3295f69346d8d5a7363c0a3324cef196d77586a",
        "eef3a671a29a7fbacb23867ccae4526f156546d2",
        "bd24c259c2d03be4433a8dedf9ca41643c76c2d8",
        "df9210a4bac66ba85a3c1c761ad2e7861a233541",
        "4d21fb6320536393b1c20f9e7e708827d161f028",
        "4086612d8350c5db2ea86c3adada8e97fd402301",
        "650f79b4ac673021a5dfde79efb141cea2a26e43",
        "21d5f1d8a48b9ee2755dbfc6654306b1191a21d2",
        "0b5241077c99ac5dc1f36a32a6cde1b007bd57af",
        "a353c12536e47defbd2b821042dfed9a103d8cf6",
        "d6d794eea497f1dac61941d2d76e094bd3ae325d",
        "310fee77f10d95bfa8073bbca35a5d6855a6b158",
        "93d8e575ac1296c29ec5b34fd7acc433b66aa52c",
        "92e21799e984a8f747a15c1088af3bd95f6d740d",
        "9b016b9b5a11753f6eff615e7e3e66c027c7584c",
        "63a1a4d8c75e92779513fe0b83ac396f2bfeef4c",
        "1648a0c13ea77d8a5e70a47fb3e2f4d3227b9aec",
        "7cdcf4769b298c8506d00784b612b649107fe4fb",
        "ab8dc6f1bed739c9b1c960822df124093f0887cb",
        "2cf482fb7e1129a1456e7a5da20a22a3ad8feb29",
        "38fb6314c401581df2349db55288f111ddec8eac",
        "aac9cc2abf04878e47248a360fbbea1aa43330a1",
        "3bf4348c0b620fb08914b50145db443de8187c1f",
        "1933d42185b705b6d71e439710d2932d7864c30f",
        "376df6942054b624f2b8765e020f84fbb804d284",
        "b98c0aa6d5720130cfe1dbed8faf40dd034996dc",
        "63f6465c0682470e7ca442bb02565412a15ab451",
        "34862d849ef808d412972cb70fb933803a18935d",
        "4528066265ee97262726c7e7b85d295b2b3367e8",
        "c25281cb737bdebb23f6e46b12f9435af8b083d7",
        "a3dbf3dc23d9c51214d65eeec37ed2c39c8bff20",
        "796911356a832cbc3357403f15a9deb857c74850",
        "31e716cd5c35ea0ddfe67f7453090fce29acfe23",
        "220b04cc3e437d167bfc09879efba401b8ac9ce1",
        "354c8477dfed8f630a2c4b343810acdecc474402",
        "6da85d921f8a149247e6a5a0b554db659797a9dc",
        "5304d3181744e93d4fd246c8c9c399bee9fe0867",
        "2126f3bfb2702317285c36d8b8fe036f887b7255",
        "f919753067c9473a7ea7628923787975a1c5f812",
        "8634fecb91cf36c4fde0632c71a5391f8c865a40",
        "98755e89e22a4b31022cbaef724f049210db99eb",
        "a95ccaa3be64781a633fce8e3a6f1f89f7eae20e",
        "14f11cc95162daa78d862d2bffa3ee8399b7de4a",
        "63a453f0b9f636469962cf62ba957e9464e7ce74",
        "480a19b2dba9b176f8e5d6cd08de62b92cc70a3e",
        "f338367a2b42ff33cf31398960b0c9322bc9f482",
        "a5fec678d004b81a0cc970742836cc236741f684",
        "2a6f17b8d7ed9ee3be3f2343d5db7539ba72e71f",
        "9456f150372a9b8a2e386cec0e34902b44f8e7b3",
        "bbb122dc0198cbc02cddc950cebd6d2b5e98be71",
        "e334752052ed27b8a43c4ed930465ee9b77c55f4",
        "b24aee8454eba81146430309c277d374a0bcbff9",
        "521861d2ada71be1d5c8447c3008161c55c9733e",
        "7b76a3b728fc5a832988a74337bff4cf1b488cd0",
        "fd86e2913224e42dba4946cca585aca478a4804c",
        "20dfff1b3ec19bca4b2b730336241e611c01f97b",
        "635e58c0ce33db652fb8be4a840c7e4ca43e130d",
        "48548b009c1a52af2f96bf0255326f99569cccbe",
        "54499a02283c28a6e3a554f21d4a619f5bbe8b5a",
        "d1979ebef7a162ca2e3b7de514698e07dd06c651",
        "6e351886a18f77e1fa6a5fbe9f79c4b64603123a",
        "2b22556623a331c648f8c2cce54c6178e332ff6b",
        "dce062e7bbcad4d079c77b27577719ba04872a33",
        "560a2c994567f2ddae833cd2e532a42309b95b4c",
        "187a657d7adff65fe32e9e1ceb9053cdcbea0f99",
        "062505e9e9d5fc3587e53f53abfe47ed5494a96c",
        "ab18ccbafa01c0a27a1bdfc09fc298b72db320b3",
        "566b446f1b15bba96c23283ce24716e42ed32fac",
        "a4c15ee8a02b52fa8e685c5e23b1510105c34c5d",
        "77030b9cd5fdd61eec3512e7c40aef98ca1c1f05",
        "7bc6310924118b9118b00bc019938b1d2b0dc0bd",
        "a12b4d7eaa447c9df3abdc019f17503df7648fcc",
        "0cf939810c868e4e2bc99378ee0333da88144892",
        "f7730789dbd8ba8fe657040dcf8ee6532d3f8240",
        "8ac99b1211d7e9df891926050a5436c838b2a221",
        "741c8e459255af7aa1cfc08ea694b8900ecda239",
        "1aa8d7cdbdd212af1917cefde10444a22dc07415",
        "a3d8a4d8abc241419c199e2038c1dd14a8872331",
        "646a0507192c5d671b11c06755d3b9b77a02b548",
        "6b0a389d0a287a51b60be6502224d893a053b512",
        "e59535719395e96ddc6da0256b544c9124fda35d",
        "ccdc2fb5cb096765942b1fce453ea1d15658afdf",
        "5ea589875a001fd156538c53513028f83d1000f8",
        "e40fec46ad9ff29743ece84140115fe246e5661b",
        "bad2ef063f4839f7ede40a1abf104f45342a6d31",
        "55182087d3eb3ab095d2f3a27a2925825fa4f5da",
        "f3586079ccf4fdaed722240def7c698dc4680620",
        "33a5dd3912e4e2068586d5e00b9899742fe915fb",
        "cec37bd70c5fdce3d7fc274adfbe84298da576f8",
        "ca5d1e403411907e2815474479a15d3f1b2aed3d",
        "9d74d803e91be57e7a66f133c3c4ed6a2f5214da",
        "3059b216f5c91ff265ede3c09259000aca751a2e",
        "ba28c2e53e4226a04272671a9ed26e6b4604b701",
        "8e147b93718afef540509aa9e994547aecd977d3",
        "4428832fa62d7303732c6f8dbc52831208382627",
        "1557f3516bdd138e13be3419f3b1c9301db2fe22",
        "2cd936f077d799857aa08c3a63b2a42fee5a9ef3",
        "d3f1e4167cbb04ab48ede5f8f7c6390ea341e6e5",
        "d3d741d3dd3e536957454869207d545bc3e0ba8e",
        "b626fc1d3a4539ba1d6b4a66162095154dafece8",
        "c6e2139996224eb8ef24a401e341cf0de081117b",
        "8466f573b349ea25944dbda9c8d76edd6bd1412d",
        "439a13ef80761ed1d1829a178dbb94a1287a8116",
        "975d9f463deda8c241c27344a7a090ee16678d57",
        "6f5795aad20ee37e4906b5108ba99bc225a6bd1f",
        "22a5a8695093cf3e2851476eef65b9ff94cba32f",
        "9cf10474c2bf187da74a72d003a01c074470ab76",
        "bb89e39688ad8869a7e7d9dd549982932623586d",
        "f7cd7b15fdd8b4a1100b8b92983a42cd51e9f867",
        "61839182413c2fc626a41ea17cea823c16f5df76",
        "ee06e55de98476a31be6dbc7eda4c4e02e412398",
        "afab234b2b2a29a3b9a5114c103e019d481cbf90",
        "7cfd272c75601fab8e5cd6e682d958758b652da0",
        "f916cdd488085b91280c3efefd24cf1e773283c4",
        "b2fbad60e4fcb742ff6eb1284bce4d88dcba4c6d",
        "0afc2c0891ee96be419db3a520360986a9d06e06",
        "ba99d03b04ee96a7d0b1c80efd76ff1c5eb07282",
        "864d90be7974402a43db3de14dbe784cc06668f0",
        "afc59373f52fbfe5642c77f76661f41960a4cc69",
        "5ef6328c0e493997e95134921ea21a0d668f9f6a",
        "a9123b848276fe975aa443dc028f1c443cdbbeb0",
        "e02867eda8ce3c04775a84e78f835e0fa9f3bdd8",
        "283ca4ad79f44f867c00768c114317588f5711ea",
        "e4155b1200dbc8bae50564d9f429d81915cdbd21",
        "d51f82053346b27232541603fe4609e2afe21c2a",
        "a02bcbcbe739734eed57a422cee202f1097a0555",
        "c7a348228f5821b9041a4398a28fe30b8c51e2c8",
        "5ae0993bdc90473cc38f9be46162962491e54de0",
        "2a6060afc835b87533c79f5b5524f9f463e22d36",
        "82149a2ac132737cf8dc06c6356563ac22e1bce8",
        "aef7e9bfff3f283e912bc2f419ea1d0f5b191967",
        "53667ff64e056156d6f86d146dcc6ffae587a37c",
        "cfa4123ea897cfdd541d253a0c394f74918b0cee",
        "d65955ce8fa638d252ce1534531ce1ca6009b88c",
        "18e241d1605ca3785bc33e04619d5c963b230b2c",
        "6cbe5d851f957270eddd498ed718ea0e23bd205d",
        "cb5920b5923f11a9af07c1882addad4f50e5b4b3",
        "b71be4af27e0bf6e0c1fc4104c7629c1861a9d38",
        "a014b7f20e972fe6d7d644e4f691fedc46c8acf8",
        "73f1e81549d7a4f7623d814d3dd2b130648f6f6a",
        "7cb924777ff399314cb568aca141d0865a648348",
        "257aecec11f2c2862835fa2c6f2f5e044326cbfe",
        "0c191700fc250d6699f973c7191f0f9eadd5357c",
        "0987fe94e710e3ac64095f338d28bda13ba7a4c9",
        "6f72d84c13dcb2efa07a3dfe13814b5bd3b2ef84",
        "097a7f84f2146a2e1137d42bafcc9673b9b0a3c9",
        "fc0eca1655955399ee608505f5a3165f65d5f519",
        "0574ea4d90a93114704a5e76c988227f8136d80a",
        "66f981814f1ea773a67587d5c483d14fe4fe0deb",
        "21f329b0538e63bcfd7d3c446282047d219a1524",
        "f2332d3905a5d81d6d902b5cf217208fd28e35b5",
        "a1c74d17540f1f1d9b089fbd9c7258ee4999da84",
        "5cb8032c002850b1c5cc330d69d61f54df4db4d5",
        "2ecc035361e1bdeda6119eac12dba80cdff23c77",
        "ceda51d979d31cca65c2917fcd579d436fe4cd3f",
        "b170880c16151bccd8be61fba16d460255e0130a",
        "fabf864a537e92e47869e746b4841d4c258db1ff",
        "51d8ca9f606887db744d765363677e2066901c54",